artwork_id,title,artist_id,art_type,year,image_url,description,museum_id,medium,dimensions,museum_page_url,on_view
artwork_00020,Woman Having Her Hair Combed,artist_00009,painting,1886-1888,https://collectionapi.metmuseum.org/api/collection/v1/iiif/436173/801881/main-image,"No doubt Degas intended to include this work in the 1886 Impressionist exhibition among the nudes he described in the catalogue as ""women bathing, washing themselves, combing their hair or having it combed,"" since it is his only pastel of the mid-1880s of a woman having her hair combed. Executed in large format and meticulously finished, this nude—reminiscent of Rembrandt’s famous Bathsheba at Her Bath in the Louvre—may not have been completed in time for the exhibition, or else it may have been excluded deliberately for reasons unknown.",museum_00006,"Pastel on light green wove paper, now discolored to warm gray, affixed to original pulpboard mount",29 1/8 x 23 7/8 in. (74 x 60.6 cm),https://www.metmuseum.org/art/collection/search/436173,TRUE
artwork_00021,The Toilette of Venus,artist_00008,painting,1751,https://collectionapi.metmuseum.org/api/collection/v1/iiif/435739/1653617/main-image,"Boucher executed this painting for Madame de Pompadour, the powerful, official mistress of Louis XV and Boucher’s most significant patron for nearly two decades. It was originally inserted into the carved and painted wood-panel walls of her Château de Bellevue, the construction of which prompted many commissions that became textbook examples of Rococo art. Boucher’s depiction of the goddess of love adorning herself with the help of putti encapsulates key features associated with this movement: overt theatricality, voluptuous flesh, and an asymmetrical unfurling of luxurious furniture, fabric, flowers, and pearls.",museum_00006,Oil on canvas,42 5/8 x 33 1/2 in. (108.3 x 85.1 cm),https://www.metmuseum.org/art/collection/search/435739,TRUE
artwork_00022,Whalers,artist_00006,painting,1845,https://collectionapi.metmuseum.org/api/collection/v1/iiif/437854/1685823/main-image,"Turner was seventy years old when Whalers debuted to mixed reviews at the Royal Academy exhibition of 1845. Its subject proved elusive, as the English novelist William Thackeray observed: ""That is not a smear of purple you see yonder, but a beautiful whale, whose tail has just slapped a half-dozen whale-boats into perdition; and as for what you fancied to be a few zig-zag lines spattered on the canvas at hap-hazard, look! they turn out to be a ship with all her sails."" Apparently Turner undertook the painting—which was returned to him—for the collector Elhanan Bicknell, who had made his fortune in the whale-oil business.",museum_00006,Oil on canvas,36 1/8 x 48 1/4 in. (91.8 x 122.6 cm),https://www.metmuseum.org/art/collection/search/437854,TRUE
artwork_00023,"Venice, from the Porch of Madonna della Salute",artist_00006,painting,1835,https://collectionapi.metmuseum.org/api/collection/v1/iiif/437853/799790/main-image,"Turner drew on his considerable experience as a marine painter and the brilliance of his technique as a watercolorist to create this view, in which the foundations of the palaces of Venice merge into the waters of the lagoon by means of delicate reflections. He based the composition on a rather slight pencil drawing made during his first trip to Venice, in 1819, but the painting is really the outcome of his second visit, in 1833. He exhibited this canvas to wide acclaim at the Royal Academy, London, in 1835.",museum_00006,Oil on canvas,36 x 48 1/8 in. (91.4 x 122.2 cm),https://www.metmuseum.org/art/collection/search/437853,TRUE
artwork_00024,The Card Players,artist_00005,painting,1890-1892,https://collectionapi.metmuseum.org/api/collection/v1/iiif/435868/800382/main-image,"Cézanne was in his fifties when he undertook a painting campaign devoted to giving memorable form to a subject that inspired the likes of Caravaggio and Chardin. He was determined from the start—as we see in this sturdy Provençal scene—to make it his own. Cézanne carefully crafted this composition from figure studies he had made of local farmhands. Once he had puzzled-out his conception, he continued to fine-tune the poses and positions of the card players, until they—like the four pipes hanging on the wall behind them—each fell perfectly into place. Cézanne channeled the quiet authority he achieved here into a much larger variant (Barnes Foundation, Philadelphia) and punctuated the series with three works in which he pared away extraneous details to focus his gaze on a pair of players.",museum_00006,Oil on canvas,25 3/4 x 32 1/4 in. (65.4 x 81.9 cm),https://www.metmuseum.org/art/collection/search/435868,TRUE
artwork_00025,Self-Portrait with a Straw Hat,artist_00001,painting,1887,https://collectionapi.metmuseum.org/api/collection/v1/iiif/436532/1671316/main-image,"Van Gogh produced more than twenty self-portraits during his Parisian sojourn (1886–88). Short of funds but determined nevertheless to hone his skills as a figure painter, he became his own best sitter: ""I purposely bought a good enough mirror to work from myself, for want of a model."" This picture, which shows the artist's awareness of Neo-Impressionist technique and color theory, is one of several that are painted on the reverse of an earlier peasant study.",museum_00006,Oil on canvas,16 x 12 1/2 in. (40.6 x 31.8 cm),https://www.metmuseum.org/art/collection/search/436532,TRUE
artwork_00026,Portrait of a Peasant (Patience Escalier),artist_00001,painting,1888,"https://images.nortonsimon.org/iipsrv/iipsrv.fcgi?QLT=100&IIIF=M197506P.jpf/full/!668,1002/0/default.jpg","Sunburnt and weather-beaten, the Provençal peasant Patience Escalier gazes out of Van Gogh’s picture with blazing intensity. Dazzling yellow, vivid blue, green, and red make this portrait, painted in August 1888, perhaps the artist’s most daring coloristic experiment to date. “[I]nstead of trying to reproduce exactly what I have before my eyes,” he wrote to his brother, Theo, “I use color more arbitrarily, in order to express myself with force.” He called the picture “a sort of ‘man with a hoe,’” referring to a celebrated work by the previous generation’s great painter of peasants, Jean-François Millet: Man with a Hoe, today in the J. Paul Getty Museum.",museum_00069,Oil on canvas,25 1/4 x 21 1/2 in. (64.1 x 54.6 cm),https://www.nortonsimon.org/art/detail/M.1975.06.P,TRUE
artwork_00027,Olive Trees,artist_00001,painting,1889,https://img.artsmia.org/web_objects_cache/001000/200/10/1218/mia_8017891_800.jpg,"This is one of fifteen canvases of olive trees that van Gogh executed between June and December of 1889. Earlier that year he had interned himself in the asylum of St-Paul, in the town of St-Rémy in southern France, where he would create his most profound works. The vibrant oranges and yellows suggest that the picture dates to the autumn months. Van Gogh left St-Rémy in May 1890, moving to Auvers, near Paris, where he continued to paint until his death by suicide in July.",museum_00011,Oil on canvas,,https://collections.artsmia.org/search/Vincent%20van%20Gogh,TRUE
artwork_00028,Fishing Boats at Étretat,artist_00002,painting,1885,https://art.seattleartmuseum.org/internal/media/dispatcher/96349/preview,"Other artists had painted Étretat’s boats and fishing activity before Monet, but they often saw this world in nostalgic opposition to the superficial and imported glamour of the new tourist economy. For Monet, who had grown up around boats, it was more personal. He respected and identified with the fishermen and their sturdy vessels. In his mind their incessant daily routine, hard labor, and head-to-head confrontation with nature in almost any weather were not unlike his own painting practice. This painting of stranded boats immobilized by a violent sea reflects an idea that runs throughout Monet’s correspondence: human endeavor thwarted by unpredictable nature. The boats are a close-up, visual equivalent of Monet’s own sense of impotence and frustration at forces beyond his control during this period.",museum_00010,Oil on canvas,Overall: 29 × 36 in. (73.7 × 91.4 cm) Frame: 40 1/2 × 48 3/4 in. (102.9 × 123.8 cm),https://art.seattleartmuseum.org/objects/24472/fishing-boats-at-etretat?ctx=e3c660c9d4e57a62d18c13163f0ed217c87a91de&idx=0,TRUE
artwork_00029,Water Lilies and Japanese Bridge,artist_00002,painting,1899,"https://media.artmuseum.princeton.edu/iiif/3/collection/y1972-15/full/1024,/0/default.webp","Water Lilies and Japanese Bridge represents two of Monet’s greatest achievements: his gardens at Giverny and the paintings they inspired. Monet moved to Giverny in 1883 and immediately began to develop the property. For him, the gardens were both a passion and a second artistic medium. His Asian garden was not part of the original estate; it was located on an adjacent property with a small brook, which he purchased and enlarged into a pond for a water garden in 1893. He transformed the site into an inspired vision of cool greens and calm, reflective waters, enhanced by exotic plants such as bamboo, ginkgo, and Japanese fruit trees and a Japanese footbridge. It was not until 1899, however, that he began a series of views of the site, of which this is one. A careful craftsman who reworked his canvases multiple times, Monet was committed to painting directly from nature as much as possible and for as long as he had the correct conditions; thus, he could work on as many as eight or more canvases a day, devoting as little as an hour or less to each. In this case, he set up his easel at the edge of the water-lily pond and worked on several paintings of the subject as part of a single process. Monet’s gardens and paintings show the same fascination with the effects of time and weather on the landscape. Both are brilliant expressions of his unique visual sensitivity and emotional response to nature. At Giverny, he literally shaped nature for his brush, cultivating vistas to paint.",museum_00014,Oil on canvas,90.5 x 89.7 cm (35 5/8 x 35 5/16 in.) frame: 129.5 x 132.1 x 15.3 cm (51 x 52 x 6 in.),https://artmuseum.princeton.edu/art/collections/objects/31852,TRUE
artwork_00030,The Starry Night,artist_00001,painting,1889,https://www.moma.org/media/W1siZiIsIjQ2NzUxNyJdLFsicCIsImNvbnZlcnQiLCItcXVhbGl0eSA5MCAtcmVzaXplIDIwMDB4MTQ0MFx1MDAzZSJdXQ.jpg?sha=62618546638d742f,"In creating this image of the night sky—dominated by the bright moon at right and Venus at center left—van Gogh heralded modern painting’s new embrace of mood, expression, symbol, and sentiment. Inspired by the view from his window at the Saint-Paul-de-Mausole asylum in Saint-Rémy, in southern France, where the artist spent twelve months in 1889–90 seeking reprieve from his mental illnesses, The Starry Night (made in mid-June) is both an exercise in observation and a clear departure from it. The vision took place at night, yet the painting, among hundreds of artworks van Gogh made that year, was created in several sessions during the day, under entirely different atmospheric conditions. The picturesque village nestled below the hills was based on other views—it could not be seen from his window—and the cypress at left appears much closer than it was. And although certain features of the sky have been reconstructed as observed, the artist altered celestial shapes and added a sense of glow. Van Gogh assigned an emotional language to night and nature that took them far from their actual appearances. Dominated by vivid blues and yellows applied with gestural verve and immediacy, The Starry Night also demonstrates how inseparable van Gogh’s vision was from the new procedures of painting he had devised, in which color and paint describe a world outside the artwork even as they telegraph their own status as, merely, color and paint.",museum_00017,Oil on canvas,"29 x 36 1/4"" (73.7 x 92.1 cm)",https://www.moma.org/collection/works/79802?classifications=any&date_begin=Pre-1850&date_end=2026&include_uncataloged_works=false&on_view=false&q=Vincent+van+Gogh&recent_acquisitions=false&with_images=true,TRUE
artwork_00031,Wheat Field with Cypresses,artist_00001,painting,1889,https://collectionapi.metmuseum.org/api/collection/v1/iiif/436535/2383011/main-image,"Cypresses gained ground in Van Gogh’s work by late June 1889 when he resolved to devote one of his first series in Saint-Rémy to the towering trees. Distinctive for their rich impasto, his exuberant on-the-spot studies include the Met’s close-up vertical view of cypresses (49.30) and this majestic horizontal composition, which he illustrated in reed-pen drawings sent to his brother on July 2. Van Gogh regarded the present work as one of his “best” summer landscapes and was prompted that September to make two studio renditions: one on the same scale (National Gallery, London) and the other a smaller replica, intended as a gift for his mother and sister (private collection).",museum_00006,Oil on canvas,28 13/16 × 36 3/4 in. (73.2 × 93.4 cm),https://www.metmuseum.org/art/collection/search/436535,TRUE
artwork_00032,Irises,artist_00001,painting,1890,https://collectionapi.metmuseum.org/api/collection/v1/iiif/436528/1447063/main-image,"In May 1890, just before he checked himself out of the asylum at Saint-Rémy, Van Gogh painted four exuberant bouquets of spring flowers, the only still lifes of any ambition he had undertaken during his yearlong stay: two of irises, two of roses, in contrasting color schemes and formats. In the Museum’s Irises he sought a “harmonious and soft” effect by placing the “violet” flowers against a “pink background,” which have since faded owing to his use of fugitive red pigments. Another work from this series, Roses (1993.400.5), hangs in the adjacent gallery. Both were owned by the artist’s mother until her death in 1907.",museum_00006,Oil on canvas,29 x 36 1/4 in. (73.7 x 92.1 cm),https://www.metmuseum.org/art/collection/search/436528,TRUE
artwork_00033,Peasant Woman Cooking by a Fireplace,artist_00001,painting,1885,https://collectionapi.metmuseum.org/api/collection/v1/iiif/436531/796298/main-image,"This work was made in Nuenen in late spring 1885, just after Van Gogh completed The Potato Eaters (Van Gogh Museum, Amsterdam), in the same dark hues that reminded the artist of ""green soap"" or ""a really dusty potato, unpeeled of course."" Van Gogh was ""convinced that in the long run it produces better results to paint [peasants] in their coarseness than to introduce conventional sweetness… If a peasant painting smells of bacon, smoke, potato steam—fine—that’s not unhealthy—if a stable smells of manure—very well, that’s what a stable’s for.""",museum_00006,Oil on canvas,17 3/8 x 15 in. (44.1 x 38.1 cm),https://www.metmuseum.org/art/collection/search/436531,TRUE
artwork_00034,Shoes,artist_00001,painting,1888,https://collectionapi.metmuseum.org/api/collection/v1/iiif/436533/796180/main-image,"Van Gogh painted several still lifes of shoes or boots during his Paris period. This picture, painted later, in Arles, evinces a unique return to the earlier motif. However, here Van Gogh has placed the shoes within a specific spatial context: namely, the red-tile floor of the Yellow House. Not only may we identify the setting, but perhaps the owner of the shoes as well. It has been suggested that this ""still life of old peasants' shoes"" may have been those of Patience Escalier, whose portrait Van Gogh executed around the same time, late summer 1888.",museum_00006,Oil on canvas,18 × 21 3/4 in. (45.7 × 55.2 cm),https://www.metmuseum.org/art/collection/search/436533,TRUE
artwork_00035,The Potato Peeler,artist_00001,painting,1885,https://collectionapi.metmuseum.org/api/collection/v1/iiif/438722/796048/main-image,"This painting from February/March 1885, with its restricted palette of dark tones, coarse facture, and blocky drawing, is typical of the works Van Gogh painted in Nuenen the year before he left Holland for France. His peasant studies of 1885 culminated in his first important painting, The Potato Eaters (Van Gogh Museum, Amsterdam).",museum_00006,Oil on canvas,16 x 12 1/2 in. (40.6 x 31.8 cm),https://www.metmuseum.org/art/collection/search/438722,TRUE
artwork_00036,Oleanders,artist_00001,painting,1888,https://collectionapi.metmuseum.org/api/collection/v1/iiif/436530/796038/main-image,"For Van Gogh, oleanders were joyous, life-affirming flowers that bloomed ""inexhaustibly"" and were always ""putting out strong new shoots."" In this painting of August 1888 the flowers fill a majolica jug that the artist used for other still lifes made in Arles. They are symbolically juxtaposed with Émile Zola's La joie de vivre, a novel that Van Gogh had placed in contrast to an open Bible in a Nuenen still life of 1885.",museum_00006,Oil on canvas,23 3/4 x 29 in. (60.3 x 73.7 cm),https://www.metmuseum.org/art/collection/search/436530,TRUE
artwork_00037,Olive Trees,artist_00001,painting,1889,https://collectionapi.metmuseum.org/api/collection/v1/iiif/437998/796179/main-image,"This is one of five pictures of olive orchards that Van Gogh made in November 1889. Painted directly from nature but animated by Seurat-like stippling and stylized passages of broken color, these works responded to recent compositions by Paul Gauguin and Émile Bernard. ""What I’ve done is a rather harsh and coarse realism beside their abstractions,"" Van Gogh observed, ""but it will nevertheless impart a rustic note, and will smell of the soil.""",museum_00006,Oil on canvas,28 5/8 x 36 1/4 in. (72.7 x 92.1 cm),https://www.metmuseum.org/art/collection/search/437998,TRUE
artwork_00038,Sunflowers,artist_00001,painting,1887,https://collectionapi.metmuseum.org/api/collection/v1/iiif/436524/2341734/main-image,"Van Gogh painted four still lifes of sunflowers in Paris in late summer 1887. There is an oil sketch for this picture (Van Gogh Museum, Amsterdam) as well as another painting of two sunflowers also signed and dated 1887 (Kunstmuseum Bern), and a larger canvas showing four sunflower heads (Kröller-Müller Museum, Otterlo). Paul Gauguin acquired the two smaller works, and until the mid-1890s, when he sold his most prized possessions to finance his South Seas voyage, they held pride of place above the bed in his Paris apartment.",museum_00006,Oil on canvas,17 x 24 in. (43.2 x 61 cm),https://www.metmuseum.org/art/collection/search/436524,TRUE
artwork_00039,"First Steps, after Millet",artist_00001,painting,1890,https://collectionapi.metmuseum.org/api/collection/v1/iiif/436526/794544/main-image,"In fall and winter 1889–90, while a voluntary patient at the asylum in Saint-Rémy, Van Gogh painted twenty-one copies after Millet, an artist he greatly admired. He considered his copies ""translations"" akin to a musician's interpretation of a composer's work. He let the black-and-white images—whether prints, reproductions, or, as here, a photograph that his brother, Theo, had sent—pose ""as a subject,"" then he would ""improvise color on it."" For this work of January 1890, Van Gogh squared-up a photograph of Millet's First Steps and transferred it to the canvas.",museum_00006,Oil on canvas,28 1/2 x 35 7/8 in. (72.4 x 91.1 cm),https://www.metmuseum.org/art/collection/search/436526,TRUE
artwork_00040,Women Picking Olives,artist_00001,painting,1889,https://collectionapi.metmuseum.org/api/collection/v1/iiif/436536/1878465/main-image,"At the end of 1889, Van Gogh painted three versions of this picture. He described the first as a study from nature ""more colored with more solemn tones"" (private collection) and the second as a studio rendition in a ""very discreet range"" of colors (National Gallery of Art, Washington, D.C.). The present work, the most resolved and stylized of the three, was intended for his sister and mother, to whom Van Gogh wrote: ""I hope that the painting of the women in the olive trees will be a little to your taste—I sent [a] drawing of it to Gauguin, . . . and he thought it good. . . .""",museum_00006,Oil on canvas,28 5/8 x 36 in. (72.7 x 91.4 cm),https://www.metmuseum.org/art/collection/search/436536,TRUE
artwork_00041,Roses,artist_00001,painting,1890,https://collectionapi.metmuseum.org/api/collection/v1/iiif/436534/1447064/main-image,"On the eve of his departure from the asylum in Saint-Rémy in May 1890, Van Gogh painted an exceptional group of four still lifes, to which both The Met's Roses and Irises (58.187) belong. These bouquets and their counterparts—an upright composition of irises (Van Gogh Museum, Amsterdam) and a horizontal composition of roses (National Gallery of Art, Washington)—were conceived as a series or ensemble. Traces of pink along the tabletop and rose petals in the present painting, which have faded over time, offer a faint reminder of the formerly more vivid ""canvas of pink roses against a yellow-green background in a green vase."" This painting was seized by the Nazis from Georg Simon Hirschland (1885–1942) in Essen in 1939, following Hirschland's emigration to the United States in 1938. It was restituted to his heirs in New York in 1950.",museum_00006,Oil on canvas,36 5/8 x 29 1/8 in. (93 x 74 cm),https://www.metmuseum.org/art/collection/search/436534,TRUE
artwork_00042,"La Berceuse (Woman Rocking a Cradle; Augustine-Alix Pellicot Roulin, 1851–1930)",artist_00001,painting,1889,https://collectionapi.metmuseum.org/api/collection/v1/iiif/437984/1964024/main-image,"Of the five versions of Van Gogh’s portrait of Augustine Roulin, wife of his friend the postmaster of Arles, the present canvas is the one the sitter chose for herself. Van Gogh remarked that ""she had a good eye and took the best."" He began the portraits just before his breakdown in Arles, in December 1888, and completed them in early 1889, calling them ""La Berceuse,"" meaning ""lullaby, or woman who rocks the cradle,"" indicated by the rope held in the sitter’s hand, which is attached to the unseen cradle.",museum_00006,Oil on canvas,36 1/2 × 29 in. (92.7 × 73.7 cm),https://www.metmuseum.org/art/collection/search/437984,TRUE
artwork_00043,"L'Arlésienne: Madame Joseph-Michel Ginoux (Marie Julien, 1848–1911)",artist_00001,painting,1888-1889,https://collectionapi.metmuseum.org/api/collection/v1/iiif/436529/795979/main-image,"While in Arles, Van Gogh painted two very similar portraits of Marie Ginoux, the proprietress of the Café de la Gare, wearing the regional costume of the legendary dark-haired beauties of Arles. The first version, which he described in a letter of November 1888 as ""an Arlésienne . . . knocked off in one hour,"" must be the more thinly and summarily executed portrait in the Musée d'Orsay, Paris. In it a parasol and gloves lie on the table instead of books. This portrait belonged to the sitter until she sold it in 1895.",museum_00006,Oil on canvas,36 × 29 in. (91.4 × 73.7 cm),https://www.metmuseum.org/art/collection/search/436529,TRUE
artwork_00044,Cypresses,artist_00001,painting,1889,https://collectionapi.metmuseum.org/api/collection/v1/iiif/437980/794518/main-image,"Cypresses was painted in late June 1889, shortly after Van Gogh began his yearlong stay at the asylum in Saint-Rémy. The subject, which he found ""beautiful as regards lines and proportions, like an Egyptian obelisk,"" both captivated and challenged the artist: ""It’s the dark patch in a sun-drenched landscape, but it’s one of the most interesting dark notes, the most difficult to hit off exactly that I can imagine."" One of two close-up views of the ""very tall and massive"" trees in a vertical format (the other is in the Kröller-Müller Museum, Otterlo), Cypresses was shown in the 1890 Salon des Indépendants.",museum_00006,Oil on canvas,36 3/4 x 29 1/8 in. (93.4 x 74 cm),https://www.metmuseum.org/art/collection/search/437980,TRUE
artwork_00045,Bouquet of Flowers in a Vase,artist_00001,painting,1890,https://collectionapi.metmuseum.org/api/collection/v1/iiif/436525/796516/main-image,"This still life is not mentioned in Van Gogh’s letters and has puzzled scholars as to its place in his artistic production. The subject enjoys a certain rapport with the mixed bouquets of summer flowers he made in Paris; the quasi-abstract floral wallpaper design in the Berceuse of Arles (1996.435), and the white porcelain vase in the Irises of Saint-Rémy (58.187). However, the palette and style of this painting, especially its distinctive blues and ochers and graphic, brick-shape hatchings, link it firmly with the landscapes made just prior to his death in Auvers on July 29, 1890.",museum_00006,Oil on canvas,25 5/8 x 21 1/4 in. (65.1 x 54 cm),https://www.metmuseum.org/art/collection/search/436525,TRUE
artwork_00046,The Potato Eaters,artist_00001,painting,1885,"https://iiif.micr.io/yzksg/full/1800,/0/default.webp","Van Gogh saw the Potato Eaters as a showpiece, for which he deliberately chose a difficult composition to prove he was on his way to becoming a good figure painter. The painting had to depict the harsh reality of country life, so he gave the peasants coarse faces and bony, working hands. He wanted to show in this way that they ‘have tilled the earth themselves with these hands they are putting in the dish ... that they have thus honestly earned their food’. He painted the five figures in earth colours – ‘something like the colour of a really dusty potato, unpeeled of course’. The message of the painting was more important to Van Gogh than correct anatomy or technical perfection. He was very pleased with the result: yet his painting drew considerable criticism because its colours were so dark and the figures full of mistakes. Nowadays, the Potato Eaters is one of Van Gogh’s most famous works.",museum_00081,Oil on canvas,"82 cm x 114 cm, 100 cm x 133 cm",https://www.vangoghmuseum.nl/en/collection/s0005V1962,TRUE
