artwork_id,title,artist_id,art_type,year,image_url,description,museum_id,medium,dimensions,museum_page_url,on_view
artwork_00047,Garden with Courting Couples: Square Saint-Pierre,artist_00001,painting,1887,"https://iiif.micr.io/PkNZD/full/600,/0/default.webp","Van Gogh called this sunny park scene 'the painting of the garden with lovers'. Couples in love are strolling under the young chestnut trees and sitting along the winding paths. He used a free variation on the technique of the Pointillists. They built up their compositions from dots of paint. Van Gogh instead applied small brushstrokes of varying length in different directions. This helped him to create the effect of a radiant spring day, which fit the sense of intimacy and togetherness he wished to express. He too longed for a wife and a family, but he had 'the most impossible love affairs'. He eventually resigned himself to the situation; he was devoted to his art.",museum_00081,Oil on canvas,"75 cm x 113 cm, 95 cm x 132.4 cm, 10 cm",https://www.vangoghmuseum.nl/en/collection/s0019V1962,TRUE
artwork_00048,Sunflowers,artist_00001,painting,1889,"https://iiif.micr.io/TZCqF/full/600,/0/default.webp","Van Gogh’s paintings of Sunflowers are among his most famous. He did them in Arles, in the south of France, in 1888 and 1889. Vincent painted a total of five large canvases with sunflowers in a vase, with three shades of yellow ‘and nothing else’. In this way, he demonstrated that it was possible to create an image with numerous variations of a single colour, without any loss of eloquence. The sunflower paintings had a special significance for Van Gogh: they communicated ‘gratitude’, he wrote. He hung the first two in the room of his friend, the painter Paul Gauguin, who came to live with him for a while in the Yellow House. Gauguin was impressed by the sunflowers, which he thought were ‘completely Vincent’. Van Gogh had already painted a new version during his friend’s stay and Gauguin later asked for one as a gift, which Vincent was reluctant to give him. He later produced two loose copies, however, one of which is now in the Van Gogh Museum.",museum_00081,Oil on canvas,"95 cm x 73 cm, 123.6 cm x 101.2 cm",https://www.vangoghmuseum.nl/en/collection/s0031V1962,TRUE
artwork_00049,The Yellow House (The Street),artist_00001,painting,1888,"https://iiif.micr.io/NyxcG/full/600,/0/default.webp","In May 1888, Van Gogh rented four rooms in a house on Place Lamartine in Arles (southern France). The green shutters in this painting of the square show where he lived. Shortly after moving into the ‘Yellow House’, he sent Theo a description and sketch of his painting of it: ‘it’s tremendous, these yellow houses in the sunlight and then the incomparable freshness of the blue.’ The work, which Van Gogh himself called ‘The Street’, records the artist’s immediate surroundings: he often ate at the restaurant on the left, and the home of his friend, the postman Joseph Roulin, lay just beyond the second railway bridge. Vincent had finally found a place at the Yellow House where he could not only paint but also have his friends come to stay. His plan was to turn the yellow corner-building into an artists’ house, where like-minded painters could live and work together.",museum_00081,Oil on canvas,"72 cm x 91.5 cm, 89.8 cm x 109.2 cm, 8 cm",https://www.vangoghmuseum.nl/en/collection/s0032V1962,TRUE
artwork_00050,The Bedroom,artist_00001,painting,1888,"https://iiif.micr.io/ZKSPH/full/600,/0/default.webp","While he was in Arles, Van Gogh made this painting of his bedroom in the Yellow House. He prepared the room himself with simple furniture and with his own work on the wall. The bright colours were meant to express absolute ‘repose’ or ‘sleep’. Research shows that the strongly contrasting colours we see in the work today are the result of discolouration over the years. The walls and doors, for instance, were originally purple rather than blue. The apparently odd angle of the rear wall, meanwhile, is not a mistake on Van Gogh’s part – the corner really was skewed. The rules of perspective seem not to have been accurately applied throughout the painting, but this was a deliberate choice. Vincent told Theo in a letter that he had deliberately ‘flattened’ the interior and left out the shadows so that his picture would resemble a Japanese print. Van Gogh was very pleased with the painting: ‘When I saw my canvases again after my illness, what seemed to me the best was the bedroom.’",museum_00081,Oil on canvas,"72.4 cm x 91.3 cm, 92.2 cm x 111 cm, 7.2 cm",https://www.vangoghmuseum.nl/en/collection/s0047V1962,TRUE
artwork_00051,Wheatfield with a Reaper,artist_00001,painting,1889,"https://iiif.micr.io/HDzja/full/600,/0/default.webp","Van Gogh painted this walled field from his hospital room. For the first few months that he was there, he was not allowed to leave the grounds. The reaper labours in the heat of the sun. The wheat, painted with thick gobs of yellow, undulates around him. For Van Gogh, wheat was a symbol of the eternal cycle of nature and the transience of life. He saw the reaper as 'the image of death . . . in this sense that humanity would be the wheat being reaped.' He added, however, that this death was 'almost smiling. It's all yellow except for a line of violet hills – a pale, blond yellow. I myself find that funny, that I saw it like that through the iron bars of a cell.'",museum_00081,Oil on canvas,"73.2 cm x 92.7 cm, 97 cm x 116.7 cm, 11.5 cm",https://www.vangoghmuseum.nl/en/collection/s0049V1962,TRUE
artwork_00052,Almond Blossom,artist_00001,painting,1890,"https://iiif.micr.io/rAERt/full/600,/0/default.webp","Large blossom branches like this against a blue sky were one of Van Gogh’s favourite subjects. Almond trees flower early in the spring making them a symbol of new life. Van Gogh borrowed the subject, the bold outlines and the positioning of the tree in the picture plane from Japanese printmaking. The painting was a gift for his brother Theo and sister-in-law Jo, who had just had a baby son, Vincent Willem. In the letter announcing the new arrival, Theo wrote: ‘As we told you, we’ll name him after you, and I’m making the wish that he may be as determined and as courageous as you.’ Unsurprisingly, it was this work that remained closest to the hearts of the Van Gogh family. Vincent Willem went on to found the Van Gogh Museum.",museum_00081,Oil on canvas,"73.3 cm x 92.4 cm, 94 cm x 112.9 cm, 8 cm",https://www.vangoghmuseum.nl/en/collection/s0176V1962,TRUE
artwork_00053,Irises,artist_00001,painting,1890,"https://iiif.micr.io/HVTVF/full/600,/0/default.webp","Van Gogh painted this still life in the psychiatric hospital in Saint-Rémy. For him, the painting was mainly a study in colour. He set out to achieve a powerful colour contrast. By placing the purple flowers against a yellow background, he made the decorative forms stand out even more strongly. The irises were originally purple. But as the red pigment has faded, they have turned blue. Van Gogh made two paintings of this bouquet. In the other still life, he contrasted purple and pink with green.",museum_00081,Oil on canvas,"92.7 cm x 73.9 cm, 111.5 cm x 92.9 cm, 8.2 cm",https://www.vangoghmuseum.nl/en/collection/s0050V1962,TRUE
artwork_00054,Wheatfield under Thunderclouds,artist_00001,painting,1890,"https://iiif.micr.io/fhXoU/full/600,/0/default.webp","In the last weeks of his life, Van Gogh completed a number of impressive paintings of the wheatfields around Auvers. This outspread field under a dark sky is one of them. In these landscapes he tried to express 'sadness, extreme loneliness'. But the overwhelming emotions that Van Gogh experienced in nature were also positive. He wrote to his brother Theo, 'I'd almost believe that these canvases will tell you what I can't say in words, what I consider healthy and fortifying about the countryside.' The elongated format of Wheatfields under Thunderclouds is unusual. It emphasizes the grandeur of the landscape, as does the simple composition: two horizontal planes.",museum_00081,Oil on canvas,"50.4 cm x 101.3 cm, 70 cm x 121 cm, 9.5 cm",https://www.vangoghmuseum.nl/en/collection/s0106V1962,TRUE
artwork_00055,Wheatfield with Crows,artist_00001,painting,1890,"https://iiif.micr.io/QHzII/full/600,/0/default.webp","Wheatfield with Crows is one of Van Gogh's most famous paintings. It is often claimed that this was his very last work. The menacing sky, the crows and the dead-end path are said to refer to the end of his life approaching. But that is just a persistent myth. In fact, he made several other works after this one. Van Gogh did want his wheatfields under stormy skies to express 'sadness, extreme loneliness', but at the same time he wanted to show what he considered 'healthy and fortifying about the countryside'. Van Gogh used powerful colour combinations in this painting: the blue sky contrasts with the yellow-orange wheat, while the red of the path is intensified by the green bands of grass.",museum_00081,Oil on canvas,"50.5 cm x 103 cm, 69.8 cm x 122.7 cm, 10 cm",https://www.vangoghmuseum.nl/en/collection/s0149V1962,TRUE
artwork_00056,Tree Roots,artist_00001,painting,1890,"https://iiif.micr.io/giZUM/full/600,/0/default.webp","This painting seems at first sight to consist of a jumble of bright colours and fanciful abstract forms. Only after that do you realise that it shows a slope with tree trunks and roots. These are trees used for timber, growing in a marl quarry. Such quarries could be found around Auvers (FR). The work was not entirely completed. That explains its unfinished appearance. It is probably Van Gogh's very last painting. Andries Bonger, the brother-in-law of Vincent's brother Theo, described it in a letter: 'The morning before his death, he had painted a sous-bois [forest scene], full of sun and life.'",museum_00081,Oil on canvas,"50.3 cm x 100.1 cm, 69.8 cm x 119.7 cm, 9.5 cm",https://www.vangoghmuseum.nl/en/collection/s0195V1962,TRUE
artwork_00057,Self-Portrait or Portrait of Theo van Gogh,artist_00001,painting,1887,"https://iiif.micr.io/DVMeI/full/600,/0/default.webp","This painting was long thought to be a self-portrait of Vincent; however, another view is that it shows his brother Theo. The brothers, namely, bore a striking resemblance to one another. Unfortunately, there is no decisive evidence to determine who is actually portrayed, which is why the painting now has a double title. The portrait is unusually small and painted in considerable detail. Van Gogh was probably trying to compete with portrait photos. He had written some time earlier, 'it's a cause worth fighting for to show people that there's something else in human beings besides what the photographer is able to get out of them with his machine.'",museum_00081,Oil on canvas,"19 cm x 14.1 cm, 28.7 cm x 23.9 cm, 3.5 cm",https://www.vangoghmuseum.nl/en/collection/s0157V1962,TRUE